{
  "schemaVersion": "1.0.0",
  "specificationVersion": "1.0.0",
  "qualificationLockDigest": "8b86f7ee0b8f6a02605158969230d2621159512b1eef917a184618863287f582",
  "candidateEvidence": {
    "focused": {
      "path": "evidence/selected-qualification.json",
      "sha256": "aeb2745597b13bce82a1bf60417e85d47afa43d71397cb44f1da09423c2d41d2"
    },
    "integrated": {
      "path": "evidence/integrated-qualification.json",
      "sha256": "43db9d11024e79604551a71c95ead544c4aae32e4cab000c839f60665d6f75cd"
    }
  },
  "eligibility": {
    "focused": "eligible",
    "integrated": "ineligible"
  },
  "decisionBasis": "sole-focused-eligible",
  "outcome": "select-focused",
  "selectedCandidate": "focused",
  "calculation": {
    "algorithmVersion": "prd-v1.0.0",
    "focusedScore": null,
    "integratedScore": null,
    "absoluteDifference": null,
    "tieBreakApplied": false
  },
  "rationale": "Focused is the sole eligible candidate."
}
